rating,num_reviews,name,tags,directions,ingredients
,,Oasis recipe,,Shake and serve over ice.,"[(None, u'6 cl melon vodka', None), (None, u'4 cl Malibu\xae coconut rum', None), (None, u'3 cl Pisang Ambon\xae liqueur', None), (None, u'7 cl lemon juice', None), (u'1', u'cream', 'splash')]"
,,O.D. recipe,,"Shake and strain into an ice-filled double-cocktail glass filled with broken ice. Garnish with an orange twist, and serve.","[(u'1/3', u'Plymouth\xae gin', 'oz'), (u'1/3', u'dry vermouth', 'oz'), (u'1/3', u'rosso vermouth', 'oz'), (u'1/3', u'orange juice', 'oz'), (u'1/3', u'grenadine syrup', 'oz')]"
8.3,3,O-n-Coke recipe,,"Pour the Bacardi O orange rum into an old-fashioned glass half-filled with ice cubes. Add Coke to taste, and serve.","[(u'2', u'Bacardi\xae O rum', 'oz'), (u'4 - 6', u'Coca-Cola\xae', 'oz')]"
4.5,2,Oakland Cocktail recipe,,"Pour the vodka, dry vermouth and orange juice into a cocktail shaker half-filled with cracked ice. Shake well, strain into a chilled cocktail glass, and serve.","[(u'2', u'vodka', 'oz'), (u'1', u'dry vermouth', 'oz'), (None, u'1 ozfresh orange juice', None)]"
6.2,5,O Thing recipe,,"Pour the can of Amp energy drink into a tall glass. Add the Bacardi O rum (more or less acccording to taste), and serve. ","[(None, u'12 ozcan Amp\xae energy drink', None), (u'2 - 4', u'Bacardi\xae O rum', 'oz')]"
10.0,1,O-Brye recipe,,"Stir ingredients together in a shot glass, and serve.","[(u'2/3', u'rye whiskey', 'oz'), (u'1/3', u'olive juice', 'oz')]"
6.8,4,O My Martini recipe,,Shake ingredients with ice. Strain into a chilled martini glass. Top with grenadine.,"[(u'2', u'Bacardi\xae orange rum', 'oz'), (u'1', u'Blue Curacao liqueur', 'oz'), (u'1', u'sweet and sour mix', 'splash'), (None, u' top with grenadine syrup', None)]"
9.3,8,O Martini Cocktail recipe,,"Serve in a rocks glass over ice, or straight up in a martini glass.","[(u'2', u'Bacardi\xae orange rum', 'oz'), (u'1/4', u'Martini & Rossi\xae extra dry vermouth', 'oz'), (None, u'1 twist orange', None)]"
9.3,9,O Madras recipe,,Blend ingredients with ice and serve in a tall glass. Garnish with a maraschino cherry and a slice of orange.,"[(u'1 1/2', u'Bacardi\xae orange rum', 'oz'), (u'4', u'cranberry juice', 'oz'), (u'1', u'orange juice', 'oz'), (None, u'1  maraschino cherry', None), (None, u'1 slice orange', None)]"
,,O Look Martini Cocktail recipe,,Serve together in a sugar-rimmed glass garnished with a slice of grapefruit.,"[(u'2', u'Bacardi\xae orange rum', 'oz'), (None, u'1/2 ozpink grapefruit juice', None), (u'1/2', u'triple sec', 'oz'), (u'1/2', u'sweet and sour mix', 'oz'), (u'1', u'lemon-lime soda', 'splash')]"
9.4,14,O Cosmopolitan recipe,,Serve on the rocks. Garnish with a wedge of orange.,"[(u'2', u'Bacardi\xae orange rum', 'oz'), (u'1', u'triple sec', 'oz'), (u'1/2', u'lime juice', 'oz'), (u'1', u'cranberry juice', 'splash'), (None, u'1  orange', None)]"
9.5,2,O Circle Martini recipe,,"Shake ingredients with ice, strain and serve into a chilled martini glass. Garnish with a twist of orange.","[(u'1 1/2', u'Bacardi\xae orange rum', 'oz'), (u'1/2', u'Amaretto Di Saronno\xae liqueur', 'oz'), (u'1', u'cream', 'splash')]"
9.0,2,O & Cream recipe,,Shake ingredients with ice and serve in a rocks glass over ice.,"[(u'1 1/2', u'Bacardi\xae orange rum', 'oz'), (u'1 1/2', u'Irish cream', 'oz')]"
,,O Captain! My Captain! recipe,,Pour Captain Morgans on top of ice then add Mellow Yellow.  **Important: Use Mellow Yellow not Moutain Dew or any other soda substitute.**  ,"[(u'1.5', u'Captain Morgan\xae spiced rum', 'oz'), (u'7', u'Mello Yello\xae citrus soda', 'oz')]"
9.8,5,Naked Shake recipe,,"Add the vanilla schnapps, swiss mocha cream liqueur and a few ounces of half-and-half to an ice-filled cocktail shaker. Stir or shake and strain into an ice-filled highball glass. Top with a splash of coca-cola, and garnish with filbert nuts or cherries.","[(u'3/4', u'vanilla schnapps', 'oz'), (u'3/4', u'swiss chocolate almond liqueur', 'oz'), (None, u'  half-and-half', None), (None, u'  cola', None)]"
7.5,2,O & Tonic recipe,,Serve in a tall glass with ice.,"[(u'1 1/2', u'Bacardi\xae orange rum', 'oz'), (u'6', u'tonic water', 'oz'), (None, u'1 twist orange', None)]"
8.0,6,O & Cranberry recipe,,Stir together in a tall glass over ice. Garnish with an orange wedge.,"[(u'1 1/2', u'Bacardi\xae orange rum', 'oz'), (u'5', u'cranberry juice', 'oz'), (None, u'1  orange', None)]"
8.6,12,Naked on the Bathroom Floor recipe,,"Stir together in a short glass, and serve.","[(u'1/2', u'tequila', 'oz'), (u'1/2', u'Rumple Minze\xae peppermint liqueur', 'oz'), (u'1/2', u'Jagermeister\xae herbal liqueur', 'oz'), (u'1/2', u'Wild Turkey\xae bourbon whiskey', 'oz'), (u'1/2', u'Goldschlager\xae cinnamon schnapps', 'oz'), (u'1/2', u'DeKuyper\xae Hot Damn cinnamon schnapps', 'oz')]"
9.3,6,Naked Sunburn recipe,,"Pour the melon liqueur, Malibu rum and creme de noyaux into a hurricane glass 3/4 filled with ice cubes. Add the 7-Up and sour mix. Fill with equal parts of pineapple and cranberry juice, to taste, and serve.","[(u'1 1/2', u'melon liqueur', 'oz'), (u'1 1/2', u'Malibu\xae coconut rum', 'oz'), (u'1 1/2', u'creme de noyaux', 'oz'), (u'2 - 4', u'cranberry juice', 'oz'), (u'2 - 4', u'pineapple juice', 'oz'), (u'1', u'7-Up\xae soda', 'splash'), (u'1', u'sweet and sour mix', 'splash')]"
9.8,5,Naked Pretzel recipe,,"Pour the vodka, melon liqueur, creme de cassis and pineapple juice into a mixing glass half-filled with cracked ice. Stir well. Strain into an old-fashioned glass 3/4 filled with ice cubes, and serve.","[(u'3/4', u'vodka', 'oz'), (u'1', u'melon liqueur', 'oz'), (u'1/2', u'creme de cassis', 'oz'), (u'2', u'pineapple juice', 'oz')]"
9.7,20,Naked Lady recipe,,"Pour the white rum, sweet vermouth, apricot brandy, grenadine and lemon juice into a cocktail shaker half-filled with ice cubes. Shake well, strain into a highball glass, and serve.","[(u'1', u'white rum', 'oz'), (u'1', u'sweet vermouth', 'oz'), (u'4', u'apricot brandy', 'dashes'), (u'2', u'grenadine syrup', 'dashes'), (u'4', u'lemon juice', 'dashes')]"
4.5,2,Naked Pear recipe,,"Mix apple vodka, melon liqueur and triple sec in a shaker. Fill a glass with ice. Pour the ingredients from the shaker into glass. Fill the rest of the glass with sour mix and pineapple, garnish with a cherry. ","[(u'1/2', u'Smirnoff\xae Green Apple Twist vodka', 'oz'), (u'1/2', u'melon liqueur', 'oz'), (u'1/2', u'triple sec', 'oz'), (u'4', u'pineapple juice', 'splashes'), (u'3', u'sweet and sour mix', 'splashes')]"
6.8,13,Naked Navel recipe,,"Both vodka and schnapps should be kept in the freezer prior to making. Pour vodka into a shot glass, and add the schnapps, forming a ball in the bottom of the glass.","[(u'1', u'Absolut\xae vodka', 'oz'), (u'1/2', u'peach schnapps', 'oz')]"
9.2,61,Naked Girl Scout recipe,,Mix and serve in a shot glass.,"[(u'1', u'Godiva\xae chocolate liqueur', 'part'), (u'1', u'Rumple Minze\xae peppermint liqueur', 'part')]"
9.9,7,Naked Barbie recipe,,Pour all ingredients into glass over ice. ,"[(u'1', u'Malibu\xae coconut rum', 'oz'), (u'1/2', u'strawberry liqueur', 'oz'), (u'5', u'pineapple juice', 'oz')]"
10.0,1,Nail Puller recipe,,Mix over ice in a highball glass. ,"[(u'1', u'vodka', 'oz'), (u'2', u'Kahlua\xae coffee liqueur', 'oz'), (u'4', u'Dr. Pepper\xae soda', 'oz')]"
,,Naked in the Bathtub recipe,,"Pour over ice in your favorite glass, vodka first.","[(u'2', u'Svedka\xae vodka', 'oz'), (u'6', u'DaVinci Gourmet\xae vanilla syrup', 'oz')]"
8.0,2,Nagle recipe,,"Pour Southern Comfort and Goldshlager in equal parts into a shot glass. Add a splash of lime juice, and serve.","[(u'1/2', u'Southern Comfort\xae peach liqueur', 'oz'), (u'1/2', u'Goldschlager\xae cinnamon schnapps', 'oz'), (u'1', u'lime juice', 'splash')]"
8.0,4,Nagshead Lemonade recipe,,"Stir ingredients together in a highball glass filled with ice cubes, and serve.","[(u'1', u'gin', 'oz'), (u'1', u'peach schnapps', 'oz'), (u'1', u'triple sec', 'oz'), (u'3', u'sweet and sour mix', 'oz'), (u'1', u'grenadine syrup', 'tsp')]"
9.3,3,Nagel Nectar recipe,,Combine butterscotch schnapps and milk in an old-fashioned glass filled with ice cubes.,"[(None, u'3 shots butterscotch schnapps', None), (None, u'3 shots milk', None)]"
9.4,7,Nagermeister recipe,,"Pour kahlua into an irish coffee cup. Add jagermeister, fill with coffee and serve with cream on top.","[(None, u'2 cl Jagermeister\xae herbal liqueur', None), (None, u'2 cl Kahlua\xae coffee liqueur', None), (None, u'  coffee', None)]"
,,Nadir Cocktail recipe,,"Pour the gin, cherry brandy, lemon juice, strawberry syrup, grenadine and pineapple juice into a cocktail shaker half-filled with ice cubes. Shake well, strain into a highball glass filled with ice cubes, and fill with soda water. Garnish with a slice of pineapple, and serve.","[(u'1 2/3', u'gin', 'oz'), (u'1/3', u'cherry brandy', 'oz'), (u'2/3', u'lemon juice', 'oz'), (u'2/3', u'strawberry syrup', 'oz'), (u'1/2', u'grenadine syrup', 'oz'), (u'2', u'pineapple juice', 'tsp'), (u'3', u'soda water', 'oz')]"
6.0,1,Nadir Blue recipe,,"Pour the gin, cherry brandy, lemon juice, strawberry syrup, grenadine and pineapple juice into a cocktail shaker half-filled with ice cubes. Shake well, strain into a highball glass filled with ice cubes, and fill with soda water. Pour the blue curacao into the middle. Garnish with a slice of pineapple, and serve.","[(u'1 2/3', u'gin', 'oz'), (u'1/3', u'cherry brandy', 'oz'), (u'2/3', u'lemon juice', 'oz'), (u'2/3', u'strawberry syrup', 'oz'), (u'1/2', u'grenadine syrup', 'oz'), (u'2', u'pineapple juice', 'tsp'), (u'2 1/2', u'soda water', 'oz'), (u'2/3', u'Blue Curacao liqueur', 'oz')]"
5.5,2,NA-4 recipe,,"Mix equal parts of all ingredients, varying depending on how strong you would like it and which of the flavors you like best. Serve cold and enjoy!","[(u'1', u'vodka', 'part'), (u'1', u'Gatorade\xae energy drink', 'part'), (u'1', u'energy soda', 'part'), (u'1', u'Hawaiian Punch\xae', 'part')]"
8.0,1,Macbeth Cocktail recipe,,Shake ingredients with ice; strain into a cocktail glass. ,"[(u'2', u'Scotch whisky', 'oz'), (u'2', u'Blue Curacao liqueur', 'tsp'), (u'2', u'amaretto almond liqueur', 'tsp'), (u'1/2', u'lemon juice', 'oz'), (u'1', u'sugar', 'tsp')]"
8.5,6,N'awlins Mudslide recipe,,Add ice to an old-fashioned glass and add all three ingredients. Swirl the glass to blend the colors. Prolonged sipping is suitable or drink it like a shot. Savor the flavor!,"[(u'1', u'Praline New Orleans-style pecan liqueur', 'oz'), (u'1', u'Kahlua\xae coffee liqueur', 'oz'), (u'1', u""Bailey's\xae Irish cream"", 'oz')]"
,,Macbeth #2 recipe,,Shake ingredients in a cocktail shaker. Strain into glass. ,"[(u'1', u'Drambuie\xae Scotch whisky', 'oz'), (u'3/4', u'Strega\xae herbal liqueur', 'oz')]"
9.3,3,MacAttack recipe,,"Add gin and midori to a shaker with ice, and fill with equal parts of grape juice and club soda. Shake and strain over ice in a hurricane glass.","[(u'1', u'gin', 'oz'), (u'1', u'Midori\xae melon liqueur', 'oz'), (None, u'  grape juice', None), (None, u'  club soda', None)]"
7.0,1,Macatini recipe,,Shake Vodka and Macadamia liquor. Strain into cocktail glass. Garnish with lime wheel (slice).,"[(u'1 1/2', u'vodka', 'oz'), (u'1', u'Macadamia nut liqueur', 'tbsp')]"
,,MacArthur Cocktail recipe,,"Shake the rums, triple sec and egg white together in a cocktail shaker half-filled with ice. Strain into a cocktail glass, and serve.","[(u'1 1/2', u'Bacardi\xae dark rum', 'oz'), (u'3', u'Jamaican dark rum', 'dashes'), (u'3/4', u'triple sec', 'oz'), (u'1', u'egg', 'dash')]"
2.0,1,Macarena Mist recipe,,"Shake all ingredients with ice, strain into an old-fashioned glass over crushed ice, and serve.","[(u'1', u'Kahlua\xae coffee liqueur', 'oz'), (u'1/2', u'Malibu\xae coconut rum', 'oz'), (u'1/2', u'white creme de menthe', 'oz'), (u'1 1/2', u'heavy cream', 'oz')]"
5.0,1,Macaroon recipe,,"Pour the vodka, chocolate liqueur and amaretto into a mixing glass half-filled with cracked ice. Stir well. Strain into a chilled cocktail glass, garnish with a twist of orange, and serve.","[(u'3', u'vodka', 'oz'), (u'1/2', u'chocolate liqueur', 'oz'), (u'1/2', u'amaretto almond liqueur', 'oz')]"
,,Mac Dawg recipe,,Add a 1/2 can of Red Bull and 1 shot of vodka to a glass with some ice. Finally add a splash of grenadine. ,"[(u'1', u'vodka', 'oz'), (u'1', u'grenadine syrup', 'splash'), (u'4', u'Red Bull\xae energy drink', 'oz')]"
8.0,1,Macaroni recipe,,"Stir over ice cubes in an aperitif glass. Fill with water, and serve.","[(u'3/4', u'bianco vermouth', 'oz'), (u'1', u'Pernod\xae licorice liqueur', 'dash'), (u'3', u'water', 'oz')]"
,,Mac Daddy recipe,,Shake ingredients with ice; strain into a cocktail glass. ,"[(u'2', u'gin', 'oz'), (u'1/2', u'maraschino liqueur', 'oz'), (u'1', u'pineapple juice', 'oz')]"
,,Ma' Bonnie Wee Hen recipe,,Shake ingredients with ice; strain into a cocktail glass. ,"[(u'1 1/2', u'Scotch whisky', 'oz'), (u'1/2', u'cream sherry', 'oz'), (u'1/2', u'grenadine syrup', 'oz'), (u'1/2', u'lemon juice', 'oz'), (u'1', u'orange juice', 'tsp')]"
,,Ma Wee Hen recipe,,Combine ingredients in a shaker half-filled with ice cubes. Shake well and strain into a cocktail glass.,"[(u'1 1/2', u'Scotch whisky', 'oz'), (u'1/2', u'dry sherry', 'oz'), (u'1/2', u'orange juice', 'oz'), (u'1/2', u'lemon juice', 'oz'), (u'1', u'grenadine syrup', 'tsp')]"
,,Ma Wee Hen recipe,,"Shake all ingredients with ice cubes, strain into a cocktail glass, and serve.","[(u'1 1/2', u'Scotch whisky', 'oz'), (u'1/2', u'dry sherry', 'oz'), (u'1/2', u'orange juice', 'oz'), (u'1/2', u'lemon juice', 'oz'), (u'1', u'grenadine syrup', 'tsp')]"
10.0,4,Ma Bonnie Wee Hen recipe,,Combine ingredients in a shaker half-filled with ice cubes. Shake well and strain into a cocktail glass.,"[(u'1 1/2', u'Scotch whisky', 'oz'), (u'1/2', u'cream sherry', 'oz'), (u'1/2', u'orange juice', 'oz'), (u'1/2', u'lemon juice', 'oz'), (u'1', u'grenadine syrup', 'tsp')]"
9.5,8,M3 recipe,,"Add the Malibu mango rum to an old-fashioned glass filled with ice cubes. Add the pineapple juice and then the soda/punch. Stir well, and serve.","[(u'2', u'Malibu\xae mango rum', 'oz'), (u'1', u'pineapple juice', 'oz'), (u'1', u'Sprite\xae soda', 'oz'), (u'1/2', u'Minute Maid\xae fruit punch', 'oz')]"
10.0,1,M16 recipe,,Mix the Malibu and Hynotiq. Add just enough Bacardi 151 to light. Blow or stamp out with your hand and shoot. ,"[(u'1/2', u'Malibu\xae coconut rum', 'oz'), (u'1/2', u'Hpnotiq\xae liqueur', 'oz'), (u'1', u'Bacardi\xae 151 rum', 'splash')]"
8.2,5,M.V.P. recipe,,"Pour vodka, midori, and malibu into an ice-filled hurricane glass. Fill with pineapple juice. Stir or shake.","[(u'2', u'Absolut\xae vodka', 'oz'), (u'1', u'Midori\xae melon liqueur', 'oz'), (u'1', u'Malibu\xae coconut rum', 'oz'), (None, u' fill with pineapple juice', None)]"
,,M.O.A.B. recipe,,Pour the Tullamore and Bailey's into a pint glass.  Pour the Guinness into a shot glass. Drop the Guinness shot into the pint glass and slam it.,"[(u'2 1/2', u'Tullamore Dew\xae Irish whiskey', 'oz'), (u'2 1/2', u""Bailey's\xae Irish cream"", 'oz'), (u'1', u'Guinness\xae stout', 'oz')]"
4.1,7,M.O.A.B. recipe,,"Drop a shot glass filled with equal parts of Jack Daniel's and Jim Beam into a pint of American beer, and serve.","[(u'1/2', u""Jack Daniel's\xae Tennessee whiskey"", 'oz'), (u'1/2', u'Jim Beam\xae bourbon whiskey', 'oz'), (None, u'1 pint beer', None)]"
10.0,1,M.J.A. recipe,,"Carefully layer ingredients into a shot glass, in order; Midori melon liqueur on the bottom, Jack Daniel's whiskey in the middle, absinthe on top. Serve.","[(u'1/3', u'Midori\xae melon liqueur', 'oz'), (u'1/3', u""Jack Daniel's\xae Tennessee whiskey"", 'oz'), (u'1/3', u'absinthe herbal liqueur', 'oz')]"
8.1,11,M&M's Shot recipe,,"Stir together in a shot glass, and serve.","[(u'1', u'Captain Morgan\xae Original spiced rum', 'oz'), (u'1', u'Mountain Dew\xae citrus soda', 'oz')]"
9.3,7,M&M recipe,,Serve straight up in a shot glass.,"[(u'1/2', u'Frangelico\xae hazelnut liqueur', 'oz'), (u'1/2', u'creme de cacao', 'oz')]"
7.6,13,Jack Ass recipe,,"Pour the Jack Daniel's tennessee whiskey into a shot glass. Top with 151 proof rum, and serve.","[(u'1/2', u""Jack Daniel's\xae Tennessee whiskey"", 'oz'), (u'1/2', u'151 proof rum', 'oz')]"
7.0,3,Jack Brisk recipe,,"Pour Jack Daniels into a collins glass half-filled with ice cubes, then fill with lipton brisk, stir and serve.","[(u'3', u""Jack Daniel's\xae Tennessee whiskey"", 'oz'), (u'9', u'Lipton\xae Brisk iced tea', 'oz')]"
,,Jack Bauer recipe,,"Pour ingredients into cocktail shaker over ice, shake, strain into shot glasses. Drop glasses into mug of Keith's, as done with a depth charge. Chug beer and catch shot glass.","[(u'3/4', u'Glenfiddich\xae Scotch whisky', 'oz'), (u'3/4', u""Jack Daniel's\xae Tennessee whiskey"", 'oz'), (u'1/4', u'vodka', 'oz'), (u'1/4', u'rum', 'oz'), (None, u""1 bottle Alexander Keith's\xae India Pale Ale"", None)]"
7.0,5,Jack and Dewanne recipe,,"Stir ingredients together in an old-fashioned glass (more or less mountain dew, to taste), and serve.","[(u'1 1/2', u""Jack Daniel's\xae Tennessee whiskey"", 'oz'), (u'5', u'Mountain Dew\xae citrus soda', 'oz')]"
8.4,20,Jack and The Dr. recipe,,"Pour Jack Daniel's whiskey and Dr. Pepper into a tall glass, stir, and serve.","[(None, u""3 ozpre-chilled Jack Daniel's\xae Tennessee whiskey"", None), (None, u'12 ozpre-chilled can Dr. Pepper\xae soda', None)]"
9.6,797,Jack and Coke recipe,,"Pour jack daniels into large glass filled with ice. Pour coca-cola into the glass. Stir lightly.

","[(u'2', u""Jack Daniel's\xae Tennessee whiskey"", 'oz'), (u'10', u'Coca-Cola\xae', 'oz')]"
9.7,28,Jack and Cherry Coke recipe,,"Pour Jack Daniels into a large glass half-filled with ice. Pour cherry coke into the glass. Stir lightly, and serve.","[(u'2', u""Jack Daniel's\xae Tennessee whiskey"", 'oz'), (u'10', u'Coca-Cola\xae Cherry Coke', 'oz')]"
9.6,128,Jack and Ginger recipe,,Fill glass with ice. Pour jack daniels then add ginger ale. Stir.,"[(u'2', u""Jack Daniel's\xae Tennessee whiskey"", 'oz'), (u'10', u'ginger ale', 'oz')]"
,,Jack 'N' Berry Lemonade recipe,,"Muddle the blackberries and sugar in the bottom of a pint glass.,
Add blackberry infused Jack Daniels and Ice. Fill with lemonade.,
Shake 2-3 times. Enjoy","[(None, u""2 ozblackberry infused Jack Daniel's\xae Tennessee whiskey"", None), (None, u'8 fresh blackberries', None), (u'9', u'lemonade', 'oz'), (None, u'1 tbspfine sugar', None)]"
8.7,9,Jack and Cherries recipe,,"Put the ice cubes into a tall glass, and add Jack Daniel's Tennessee whiskey. Stirring continuously, add the Coca-cola, grenadine, cherry juice, and top off with a cherry.","[(u'1', u""Jack Daniel's\xae Tennessee whiskey"", 'oz'), (None, u'12 ozcan Coca-Cola\xae', None), (u'1 1/2', u'grenadine syrup', 'oz'), (u'2', u'maraschino cherry juice', 'tbsp'), (None, u'1  maraschino cherry', None), (None, u'4 - 5  ice cubes', None)]"
9.8,9,Jacardi recipe,,"Stir together in a shot glass, and serve.","[(u'1/2', u'Bacardi\xae white rum', 'oz'), (u'1/2', u""Jack Daniel's\xae Tennessee whiskey"", 'oz')]"
9.0,2,Jacana recipe,,Shake all ingredients with ice and strain into a chilled cocktail glass.,"[(u'1 1/2', u'tequila', 'oz'), (u'1/2', u'Grand Marnier\xae orange liqueur', 'oz'), (u'1/2', u'Cointreau\xae orange liqueur', 'oz'), (None, u'3/4 ozfresh lime juice', None), (None, u'1 ozfresh grapefruit juice', None)]"
9.8,5,Jabroni Driver Shot recipe,,Add the Cognac brandy and rootbeer schnapps to a shot glass. Top with whipped cream and serve.,"[(u'1/2', u'cognac', 'oz'), (u'1/2', u'root beer schnapps', 'oz'), (u'1/4', u'whipped cream', 'oz')]"
10.0,1,J. R.'s Revenge recipe,,"In a mixing glass half-filled with ice cubes, combine all of the ingredients. Stir well. Strain into a cocktail glass.","[(u'3', u'bourbon whiskey', 'oz'), (u'1/2', u'Southern Comfort\xae peach liqueur', 'oz'), (u'2', u'bitters', 'dashes')]"
9.7,15,J.R.'s Wonderpunch recipe,,"About 4 hours before punch is to be served, combine fruit of choice in a bowl with everclear. Stir. About 1 hour before punch is to be ready, add some Sunny Delight.,
When you are ready, put the fruit/everclear/SD mix into a large cooler and add rest of handle of Everclear. Then, add all of the ingredients and stir. ,
Variations on final taste can be added with the sugar and raspberry lemonade mix. Calculations make it roughly 1 complete shot of everclear per cup. Serve it up in those fancy red or blue solos.","[(None, u'1 3/4 liters Everclear\xae alcohol', None), (None, u'2 liters Sprite\xae soda', None), (u'1', u'Sunny Delight\xae California Style orange juice', 'gal'), (u'1', u'Minute Maid\xae fruit punch', 'gal'), (None, u'8 lb ice', None), (None, u'1/2 container Country Time\xae raspberry lemonade mix', None), (None, u'1.5 - 2.5 lb sugar', None)]"
7.0,2,J. R.'s Godchild recipe,,"In a shaker half-filled with ice cubes, combine the boubon, amaretto, and milk. Shake well. Pour into an old-fashioned glass.","[(u'2', u'bourbon whiskey', 'oz'), (u'1/2', u'amaretto almond liqueur', 'oz'), (u'1', u'milk', 'oz')]"
7.3,3,J. R.'s Dallas Martini recipe,,"Splash the vermouth into chilled 10-oz martini glass, swirl and spill. Half-fill a cocktail shaker with cracked ice, add vodka and shake vigorously. Strain into glass. Garnish with several extra large green olives stuffed with aged Roquefort cheese, one will not be enough.","[(u'4', u'Belvedere\xae vodka', 'oz'), (u'1', u'Martini & Rossi\xae extra dry vermouth', 'splash'), (None, u' Reese Extra Large Green olives', None), (None, u' aged Roquefort cheese', None)]"
9.9,9,J. R.'s Godfather recipe,,"In an old-fashioned glass almost filled with ice cubes, combine both of the ingredients. Stir to mix the flavors.","[(u'2', u'bourbon whiskey', 'oz'), (u'1/2', u'amaretto almond liqueur', 'oz')]"
8.0,1,J-Unit's Wookie Surprise recipe,,"Mix everything together in a big bowl. Then fit as many people around the bowl with straws as possible, and drink as fast as possible.","[(None, u'1 bottle Everclear\xae alcohol', None), (None, u'1/2 bottle watermelon vodka', None), (None, u'1 pint sherbet', None), (None, u'1 liter Sprite\xae soda', None)]"
8.5,6,J-Pop Idol recipe,,"Pour the Alize Bleu liqueur down the side of an old-fashioned glass filled with ice cubes. Allow it to sit before adding the Gekkaikan sake. Add Sunny Delight orange juice, stir and serve.","[(u'1', u'Alize\xae Bleu liqueur', 'oz'), (u'2', u'Gekkaikan sake', 'oz'), (u'2', u'Sunny Delight\xae orange juice', 'oz')]"
,,J face recipe,,Pour Kahlua in first followed by the Frangelico then lastly the Malibu.,"[(u'1/2', u'Malibu\xae coconut rum', 'oz'), (u'1/2', u'Frangelico\xae hazelnut liqueur', 'oz'), (u'1/2', u'Kahlua\xae coffee liqueur', 'oz')]"
10.0,3,J-Lu recipe,,"Pour just under half a shot glass full of Dooleys, then add Tequila Rose, leaving enough room to add a dash of Tia Maria. Serve.","[(u'1/2', u""Dooley's Original Toffee & Vodka"", 'oz'), (u'1/2', u'Tequila Rose\xae strawberry cream liqueur', 'oz'), (u'1', u'Tia Maria\xae coffee liqueur', 'dash')]"
10.0,4,J C recipe,,"Add all ingredients to a highball glass over 3 - 4 ice cubes. Add a slice of lime, and serve.","[(u'1', u'gin', 'oz'), (u'1', u""Rose's\xae lime juice"", 'dash'), (None, u'2 - 3 drops Angostura\xae bitters', None), (u'6 - 10', u'lemonade', 'oz')]"
9.5,2,La Floridita Daiquiri recipe,,"Shake briefly with a glassful of crushed ice, and pour unstrained into a frosted cocktail glass. Serve.","[(u'2', u'white rum', 'oz'), (u'1/4', u'maraschino liqueur', 'oz'), (u'1', u'lime juice', 'oz'), (u'2/3', u'sugar syrup', 'oz')]"
10.0,3,La Cafe recipe,,Blend. Garnish with shaved chocolate.,"[(u'3/4', u'Stoli\xae Kafya vodka', 'oz'), (u'3/4', u'Marie Brizard\xae Chocolat Royal liqueur', 'oz'), (u'3/4', u'half-and-half', 'oz'), (u'1/4', u'sugar syrup', 'oz')]"
6.6,5,La Brea Tar Pit recipe,,"Stir ingredients together in an old-fashioned or lowball glass, and serve.","[(u'2', u'Kahlua\xae coffee liqueur', 'oz'), (u'1', u'clam juice', 'splash')]"
,,La Carre recipe,,"Pour ingredients into a mixing glass half-filled with ice cubes. Stir well, strain into a cocktail glass, and serve.","[(u'1 1/2', u'vodka', 'oz'), (u'2', u'dry vermouth', 'tsp'), (u'2', u'Kummel\xae caraway liqueur', 'tsp')]"
6.8,5,La Bomba Negra recipe,,"Pour the rum into a cocktail shaker half-filled with cubed or cracked ice. Add the sugar, and squeeze in the juice from the lime. Shake vigorously. Strain into a cocktail glass, and serve.","[(u'2', u'Mount Gay\xae Barbados rum', 'oz'), (None, u'1 small lime', None), (u'1', u'brown sugar', 'tsp')]"
9.6,6,La Floridita Cocktail recipe,,"Shake well over ice cubes in a shaker, strain into a chilled cocktail glass, and serve.","[(u'1 1/2', u'white rum', 'oz'), (u'3/4', u'rosso vermouth', 'oz'), (u'2 - 3', u'white creme de cacao', 'dashes'), (u'1', u'grenadine syrup', 'dash'), (u'1/2', u'lime juice', 'oz')]"
10.0,3,La Cucharacha recipe,,Mix all ingredients together in a small brandy glass or wine glass. Light drink on fire and drink as fast as possible through a straw! Caution...this is a very strong drink! ,"[(u'3', u'brandy', 'oz'), (u'1', u'Jose Cuervo\xae Clasico silver tequila', 'oz'), (u'2', u'Kahlua\xae coffee liqueur', 'oz'), (u'2', u'Smirnoff\xae Blue Label vodka', 'oz')]"
8.8,11,La Bomba recipe,,Shake all ingredients (except grenadine) with ice 3 times. Pour into sugar rimmed cocktail glass. Add grenadine and garnish with a lime wheel.,"[(u'1 1/4', u'gold tequila', 'oz'), (u'3/4', u'Cointreau\xae orange liqueur', 'oz'), (u'1 1/2', u'pineapple juice', 'oz'), (u'1 1/2', u'orange juice', 'oz'), (u'2', u'grenadine syrup', 'dashes')]"
