rating,num_reviews,name,tags,directions,ingredients
2.5,16,H-Bomb recipe,,"Dump out six ounces of beer, add alcohol, fill up the rest of the beer can with water, mix and let settle.","[(u'12', u'beer', 'oz'), (u'6', u'water', 'oz'), (u'1/8', u'alcohol', 'oz')]"
,,Hairy Jerry recipe,,Add dark rum to an ice-filled glass. Fill to the top with papaya juice.,"[(u'2 1/2', u""Myer's\xae dark rum"", 'oz'), (None, u' fill with papaya juice', None), (None, u'  ice', None)]"
5.5,2,Hairy Muff recipe,,"Stir all ingredients together with crushed ice in an old-fashioned glass, and serve.","[(u'1', u'Bundaberg\xae dark rum', 'oz'), (u'1', u'Johnnie Walker\xae Scotch whisky', 'oz'), (u'1', u'Smirnoff\xae vodka', 'oz'), (u'1/2', u'Coca-Cola\xae', 'oz'), (u'1/2', u'Red Bull\xae energy drink', 'oz')]"
9.0,25,Hairy Navel recipe,,"Stir all ingredients together in a highball glass almost filled with ice cubes, and serve.","[(u'3/4', u'vodka', 'oz'), (u'3/4', u'peach schnapps', 'oz'), (u'5', u'orange juice', 'oz')]"
4.0,3,Hairy Murry recipe,,"Shake all ingredients together in a cocktail shaker. Strain into a cocktail glass, and serve.","[(u'1', u'tequila', 'oz'), (u'1', u'Jagermeister\xae herbal liqueur', 'oz'), (u'1', u'triple sec', 'oz'), (u'1', u'pineapple juice', 'oz')]"
7.2,10,Hairy Lemon recipe,,"Rub salt onto the back of your hand. Bite the lemon, drink a good two mouthfuls of vodka, and lick the salt.","[(None, u'  salt', None), (None, u'  lemons', None), (None, u'  vodka', None)]"
9.6,5,Hairy Jerry recipe,,"Pour dark rum into an ice-filled collins glass. Fill with papaya juice, stir, and serve.","[(u'2 1/2', u""Myer's\xae dark rum"", 'oz'), (None, u'  papaya juice', None)]"
7.6,8,Dark Side of the Force recipe,,"Empty the 4 cans of frozen lemonade into a large container and pour in the Everclear, beer and Red Bull. Mix until all the lemonade has dissolved. Add blackcurrent syrup to taste (this will turn the mixture a dark purple colour). Serve on ice or chilled. ","[(None, u'1.75 liters Everclear\xae alcohol', None), (None, u'24 cans lager', None), (None, u'4 cans Red Bull\xae energy drink', None), (None, u'4 cansfrozen lemonade', None), (None, u'  blackcurrant syrup', None)]"
3.0,1,Dark Side recipe,,"Combine the coconut liqueur and Bacardi white rum in a shot glass, stirring to mix. Add just enough syrup to dissolve in it. The syrup should make the drink creamy but liquid enough to go down smoothly.","[(u'1/2', u'coconut liqueur', 'oz'), (u'1/2', u'Bacardi\xae white rum', 'oz'), (None, u'  chocolate syrup', None)]"
9.5,26,Ice Cream Genius recipe,,Blend all ingredients together in a blender.,"[(u'2', u'amaretto almond liqueur', 'oz'), (u'1/2', u'orange juice', 'cup'), (u'1/2', u'vanilla ice cream', 'cup')]"
8.0,10,Ice Coffee recipe,,"Stir ingredients together in a coffee mug, and serve.","[(u'1/2', u'Kahlua\xae coffee liqueur', 'oz'), (None, u'6 ozcold coffee', None)]"
,,Pain d'Epices recipe,,"Chill a martini glass. Pour the rum, Pedro Ximenez and Monin pain d'epices (gingerbread) syrup over ice in a mixing glass. By hand, squeeze the juice from half an orange into the glass. Stir slowly and at length. Strain into a martini glass, and serve.","[(u'1 2/3', u'Havana Club\xae Anejo Especial rum', 'oz'), (u'1', u'Pedro Ximinez sherry', 'oz'), (u'1/2', u'Monin\xae gingerbread syrup', 'oz'), (None, u'1 - 1 1/2 ozfreshly squeezed orange juice', None)]"
8.8,4,Ice Cream Float recipe,,"Fill a collins glass with ice. Add vanilla schnapps, fill glass with favorite soda (anything you would put on ice cream...root beer, dr. pepper, orange) leaving 1/2 inch headspace. Fill with cream.. not milk. Serve.","[(u'1', u'vanilla schnapps', 'oz'), (u'1', u'cream', 'oz'), (u'6', u'soda', 'oz')]"
1.0,1,Ice Cream Flip recipe,,Shake ingredients (all except nutmeg) in a shaker with ice and strain into coupette glass. Sprinkle nutmeg on top. ,"[(u'1', u'maraschino liqueur', 'oz'), (u'1', u'triple sec', 'oz'), (None, u'1 pinch nutmeg', None), (None, u'1  egg', None), (None, u'1 scoop vanilla ice cream', None)]"
8.5,6,Ice Chest Lemonade recipe,,"Microwave the limes and lemons for about 10 - 15 seconds in order to release the juice. Cut in half. Pour the ice into an ice chest. Add lemonade or limeade, sugar and squeeze in the juice from all the lemons and limes. Add vodka to taste. Grab the handles and shake.","[(None, u'15 - 20  limes', None), (None, u'15 - 20  lemons', None), (None, u'5 lb sugar', None), (u'1', u'lemonade', 'qt'), (None, u'20 lb ice', None), (None, u'  vodka', None)]"
9.6,5,Kahlodster recipe,,Pour each shot into a cup filled with ice cubes. Shake three times and serve.,"[(None, u'1 shot Kahlua\xae coffee liqueur', None), (None, u'1 shot vodka', None), (None, u'1 shot Jagermeister\xae herbal liqueur', None)]"
7.0,3,Queen Of Scots recipe,,Shake with ice and strain into a cocktail glass.,"[(u'1', u'sugar', 'tsp'), (u'2', u'water', 'tsp'), (u'1', u'lemon juice', 'tsp'), (u'2', u'Scotch whisky', 'oz'), (u'1/2', u'Green Chartreuse\xae', 'tsp'), (u'1/2', u'Blue Curacao liqueur', 'tsp')]"
,,Quikster's Delight recipe,,"Pour rum into an ice-filled hurricane glass. Fill with equal parts orange juice and pineapple juice. Top with grenadine, and serve.","[(u'1 1/2', u'Bacardi\xae Limon rum', 'oz'), (None, u'  orange juice', None), (None, u'  pineapple juice', None), (u'1/2', u'grenadine syrup', 'oz')]"
,,Quilt Lifter recipe,,"Shake briefly with a glassful of crushed ice in a double-cocktail glass. Garnish with fruit, and serve.","[(u'1', u'white rum', 'oz'), (u'1/2', u'dry sherry', 'oz'), (u'1/2', u'creme de bananes', 'oz'), (u'1', u'pineapple juice', 'oz'), (u'1', u'orange juice', 'oz'), (u'1/2', u'passion-fruit juice', 'oz')]"
,,Quiet But Quick recipe,,"Pour vodka, cherry brandy, orange juice and bitters into a cocktail shaker half-filled with ice cubes. Shake well, strain into a cocktail glass, and serve.","[(u'1 1/2', u'vodka', 'oz'), (u'1/2', u'cherry brandy', 'oz'), (u'1', u'orange juice', 'oz'), (u'1', u'orange bitters', 'dash')]"
,,Quicksand recipe,,"Blend all (very well) except the Kit Kat.  After pouring into glass, add Kit Kat as a decorative stirrer before serving.  ","[(u'1', u'Bacardi\xae Select rum', 'oz'), (u'1', u""Bailey's\xae Irish cream"", 'oz'), (u'1', u'Kahlua\xae coffee liqueur', 'oz'), (None, u'2 scoops vanilla ice cream', None), (None, u' handful ice cubes', None), (None, u""1 dash(small glop) Hershey's\xae chocolate syrup"", None), (None, u'1 stick Kit Kat\xae chocolate bar', None)]"
6.0,2,Quickie recipe,,Shake with ice and strain into a cocktail glass.,"[(u'1', u'bourbon whiskey', 'oz'), (u'1', u'white rum', 'oz'), (u'1/4', u'triple sec', 'oz')]"
,,Quiescent recipe,,Shake ingredients in a cocktail shaker with ice. Strain into a cocktail glass. ,"[(u'1 1/2', u'vodka', 'oz'), (u'1/2', u'cherry brandy', 'oz'), (u'1', u'orange juice', 'oz'), (u'1', u'orange bitters', 'dash')]"
7.8,5,Quick-Sand recipe,,Pour the orange juice (with the fruit pulp) over the sambuca in a highball glass.,"[(None, u'25 ml black sambuca', None), (None, u'250 ml orange juice', None)]"
6.0,4,Quick's Killaritas recipe,,Shake ingredients together in a pitcher. Serve on the rocks in a margarita glass.,"[(u'1/2', u""Rose's\xae lime juice"", 'cup'), (u'2/3', u'triple sec', 'cup'), (u'1 - 1/3', u'tequila', 'cup'), (None, u'12 ozfrozen limeade', None)]"
6.0,2,Quick Thrill recipe,,Pour into an ice-filled wine goblet.,"[(None, u'3 ozmedium red wine', None), (u'1/3', u'dark rum', 'oz'), (None, u'3 ozchilled cola', None)]"
,,Quick Start Breakfast Drink recipe,,"In a blender combine pineapple juice, bananas yogurt, strawberries, wheat germ and vanilla extract. Blend until smooth.","[(u'2', u'pineapple juice', 'cups'), (None, u'2  bananas', None), (None, u'2 cupsvanilla yoghurt', None), (None, u'1 cuphulled strawberries', None), (u'1/4', u'wheat germ', 'cup'), (u'1', u'vanilla extract', 'tsp')]"
,,Quick Slammer recipe,,Add everything into an old fashioned glass and serve. ,"[(u'2', u'whiskey', 'oz'), (u'2', u'sloe gin', 'oz'), (u'1', u'DeKuyper\xae Sour Apple Pucker schnapps', 'oz'), (u'7', u'cola', 'oz')]"
8.9,50,Quick Sex on the Beach recipe,,Shake with ice and strain into a cocktail glass.,"[(u'3', u'DeKuyper\xae Peachtree schnapps', 'oz'), (None, u'1 oz100 proof Smirnoff\xae vodka', None)]"
8.0,2,Quick Puck recipe,,"Pour gatorade into a highball glass. Add DeKuyper sour apple pucker, stir, and serve.","[(u'1', u'DeKuyper\xae Sour Apple Pucker schnapps', 'oz'), (u'4', u'Gatorade\xae energy drink', 'oz')]"
9.4,273,Quick Fuck recipe,,"Pour into a shot glass; baileys first, midori last. Shoot slowly.","[(None, u""1 cl Bailey's\xae Irish cream"", None), (None, u'1 cl Kahlua\xae coffee liqueur', None), (None, u'1 cl Midori\xae melon liqueur', None)]"
7.0,4,Quick Fox recipe,,Carefully layer each ingredient on top of the previous and serve.,"[(u'1', u'Irish cream', 'oz'), (u'1', u'melon liqueur', 'oz'), (u'1', u'Kahlua\xae coffee liqueur', 'oz')]"
,,Quick Fix recipe,,Shake ingredients in a cocktail shaker with ice. Strain into glass. ,"[(u'3', u'Canadian Club\xae whisky', 'oz'), (u'1', u'cherry whiskey', 'oz'), (u'8', u'7-Up\xae soda', 'oz')]"
,,Quick Decision recipe,,"Shake and strain into an old-fashioned glass filled with broken ice. Sprinkle with grated chocolate, and serve.","[(u'1', u'bourbon whiskey', 'oz'), (u'3/4', u""Bailey's\xae Irish cream"", 'oz'), (u'1/2', u'dark rum', 'oz'), (u'1/2', u'coffee liqueur', 'oz'), (u'3/4', u'whipping cream', 'oz')]"
8.4,8,Quentin recipe,,"Combine the rum, kahlua and cream in a shaker half-filled with ice cubes. Shake well, strain into a cocktail glass, and sprinkle with nutmeg.","[(u'1 1/2', u'dark rum', 'oz'), (u'1/2', u'Kahlua\xae coffee liqueur', 'oz'), (u'1', u'light cream', 'oz'), (None, u'1/8 tspgrated nutmeg', None)]"
10.0,3,Quelude recipe,,"In a beer mug with ice, add gin, rum, vodka, and triple sec. Fill almost to the top with the sour mix. Grenadine is optional. Pour the Razzmatazz and Blue Curacao on opposite sides. It should be blue and red with a margarita color in the middle.","[(u'1', u'gin', 'oz'), (u'1', u'light rum', 'oz'), (u'1', u'vodka', 'oz'), (u'1', u'triple sec', 'oz'), (u'1', u'grenadine syrup', 'splash'), (None, u'2 drops DeKuyper\xae Razzmatazz liqueur', None), (None, u'2 drops Blue Curacao liqueur', None), (u'4 - 6', u'sweet and sour mix', 'oz')]"
9.8,6,Queerwig recipe,,"Pour all ingredients into a glass, and stir well. Consume quickly.","[(u'2', u'milk', 'oz'), (u'2', u'beer', 'oz'), (u'1', u'gin', 'oz'), (u'1', u'peppermint schnapps', 'oz'), (u'2', u'Red Bull\xae energy drink', 'oz')]"
,,Queen's Cousin recipe,,"Pour the vodka, Grand Marnier, lime juice, bitters, Cointreau and wine into a cocktail shaker half-filled with ice cubes, and shake well. Strain into a large wine glass, and add the wine. Stir well, and serve.","[(u'1', u'vodka', 'oz'), (u'1/2', u'Grand Marnier\xae orange liqueur', 'oz'), (u'1/2', u'lime juice', 'oz'), (u'2', u'bitters', 'dashes'), (u'1', u'Cointreau\xae orange liqueur', 'tsp'), (u'3', u'sparkling white wine', 'oz')]"
10.0,4,Queeny Tini recipe,,Shake ingredients in a cocktail shaker with ice. Strain into glass. Garnish with slice of apple. ,"[(u'1', u'Smirnoff\xae Green Apple Twist vodka', 'oz'), (u'1/2', u'DeKuyper\xae Sour Apple Pucker schnapps', 'oz'), (u'1/2', u'Midori\xae melon liqueur', 'oz'), (None, u'1 slice apple', None)]"
8.0,2,Queens recipe,,"Shake with ice, strain into a cocktail glass, and serve.","[(u'1/2', u'gin', 'oz'), (u'1/2', u'dry vermouth', 'oz'), (u'1/2', u'sweet vermouth', 'oz'), (u'1/2', u'pineapple juice', 'oz')]"
7.3,4,Queen's Park Swizzle recipe,,"Squeeze lime juice into a highball glass. Add the shell, fill with crushed ice and add the mint. Pour in the rum, angostura bitters and sugar syrup. Swizzle until glass frosts. Add the soda, garnish with a sprig of mint, and serve with a straw.","[(u'2', u'dark rum', 'oz'), (u'2', u'Angostura\xae bitters', 'dashes'), (u'1/2', u'sugar syrup', 'oz'), (None, u' juice of 1/2 limes', None), (None, u'4  mint', None), (u'2', u'soda water', 'oz')]"
8.0,4,Queen Elizabeth recipe,,"Stir all ingredients with ice, strain into a cocktail glass, and serve.","[(u'1/2', u'dry vermouth', 'oz'), (u'1 1/2', u'gin', 'oz'), (u'1 1/2', u'benedictine herbal liqueur', 'tsp')]"
7.8,4,Queen Soda recipe,,Stir and serve in a highball glass with three or four ice cubes.,"[(u'2', u'butterscotch schnapps', 'oz'), (None, u'  cream soda', None)]"
7.3,3,Queen Charlotte recipe,,"Pour red wine and grenadine into a collins glass over ice cubes. Fill with lemon-lime soda, stir, and serve.","[(u'2', u'red wine', 'oz'), (u'1', u'grenadine syrup', 'oz'), (None, u'  lemon-lime soda', None)]"
6.8,6,Queen Charlie recipe,,"Pour into an ice-filled highball glass. Garnish with fruit, and serve with a straw.","[(u'1/2', u'grenadine syrup', 'oz'), (u'3', u'soda water', 'oz'), (u'3', u'lemonade', 'oz')]"
7.0,1,Queen of Hearts recipe,,Add the melon liqueur and the amaretto to a highball glass first. Then add the blue curaco and cranberry juice. ,"[(u'2', u'amaretto almond liqueur', 'oz'), (u'2', u'Midori\xae melon liqueur', 'oz'), (u'4', u'Blue Curacao liqueur', 'oz'), (u'4', u'cranberry juice', 'oz')]"
7.8,4,Queen Bee recipe,,"Shake all ingredients with ice, strain into a cocktail glass, and serve.","[(u'1', u'coffee brandy', 'oz'), (u'1 1/2', u'lime vodka', 'oz'), (u'1/2', u'cream sherry', 'oz')]"
6.7,3,Quebecer Banana Blow Job recipe,,"Mix the cream, banana liqueur and vodka into the shot glass. It has to be drank the same way as a traditional blow job, the glass on the floor and without the hands. ","[(u'1/2', u'vodka', 'oz'), (u'1/2', u'banana liqueur', 'oz'), (u'1/2', u'cream', 'oz')]"
7.5,2,Quebec Cocktail recipe,,"Pour Canadian whisky, vermouth, Amer Picon and maraschino into a mixing glass half-filled with ice cubes. Stir well, strain into a cocktail glass, and serve.","[(u'2', u'Canadian whisky', 'oz'), (u'1/2', u'dry vermouth', 'oz'), (u'1', u'Amer Picon\xae orange bitters', 'tsp'), (u'1', u'maraschino liqueur', 'tsp')]"
9.4,5,Quaker's Cocktail recipe,,"Shake all ingredients with ice, strain into a cocktail glass, and serve.","[(u'3/4', u'light rum', 'oz'), (u'3/4', u'brandy', 'oz'), (None, u' juice of 1/4 lemons', None), (u'2', u'raspberry syrup', 'tsp')]"
,,Quarter Deck Cocktail recipe,,"Stir all ingredients with ice, strain into a cocktail glass, and serve.","[(u'1 1/2', u'light rum', 'oz'), (u'1/3', u'cream sherry', 'oz'), (None, u' juice of 1/2 limes', None)]"
6.4,5,Quagmyre recipe,,"Pour ingredients into a brandy snifter. Shake until clear, and serve.","[(u'1/2', u'Canadian Club\xae whisky', 'oz'), (u'1/2', u""Bailey's\xae Irish cream"", 'oz'), (u'2', u'chocolate milk', 'oz'), (u'1 1/2', u'Kahlua\xae coffee liqueur', 'oz'), (u'1 1/2', u'Perrier\xae soda water', 'oz')]"
6.8,5,Quantum Theory recipe,,"Pour rum, strega and grand marnier into a collins glass. Add pineapple juice, and fill with sweet and sour mix. Garnish with a lemon cherry flag.","[(u'3/4', u'rum', 'oz'), (u'1/2', u'Strega\xae herbal liqueur', 'oz'), (u'1/4', u'Grand Marnier\xae orange liqueur', 'oz'), (u'2', u'pineapple juice', 'oz'), (None, u'  sweet and sour mix', None)]"
8.0,1,Quantanamo Bomb recipe,,"Drink or poor the neck out of the Corona,, Put a shot of Grenadine and a two Shots of Tequilla in it.  Put the Lime in it, Flip it up and enjoy.","[(None, u'  Corona\xae lager', None), (None, u'  tequila', None), (None, u'  grenadine syrup', None)]"
10.0,3,Karen's Melons recipe,,Build over ice in a highball glass. Fill with 7-up or Sprite. Try to toss the lime wedge from behind your back and into the drink. ,"[(u'1 1/2', u'Midori\xae melon liqueur', 'oz'), (u'1', u'vodka', 'oz'), (u'4 - 5', u'7-Up\xae soda', 'oz'), (None, u'1  lime', None)]"
8.0,1,Quaalude recipe,,"Build in an old-fashioned glass filled with ice cubes, and serve.","[(u'1', u'vodka', 'oz'), (u'1', u'hazelnut liqueur', 'oz'), (u'1', u'coffee liqueur', 'oz'), (u'1', u'milk', 'splash')]"
5.5,2,Karen Koolatta recipe,,"Fill the glass with ice. Pour Grand Marnier over ice. Add iced tea, garnish with lemon wedge. ","[(u'2', u'Grand Marnier\xae orange liqueur', 'oz'), (u'4', u'iced tea', 'oz')]"
6.0,2,QB Sneak recipe,,"Fill glass with ice. Pour rum first, then top with gatorade. Stir and serve. ","[(u'3', u'Bacardi\xae 151 rum', 'oz'), (None, u'  Gatorade\xae strawberry energy drink', None)]"
8.0,2,Karamozov Koffee recipe,,"Pour all ingredients into a cocktail shaker half-filled with cracked ice. Strain into a chilled cocktail glass, or serve in a tall glass with iced coffee and with/without cream.","[(u'1', u'Stoli\xae Kafya vodka', 'oz'), (u'1', u'Amaretto Di Saronno\xae liqueur', 'oz'), (u'1', u'white creme de cacao', 'oz')]"
,,Kappa Colada recipe,,Shake everything with ice; strain into a collins glass with ice. ,"[(u'1', u'brandy', 'oz'), (u'1', u'cream of coconut', 'oz'), (u'2', u'pineapple juice', 'oz')]"
9.6,69,Kansas City Ice Water recipe,,"Pour gin, vodka and lime juice over ice in a highball glass. Fill with 7-up, and serve.","[(u'3/4', u'gin', 'oz'), (u'3/4', u'vodka', 'oz'), (u'1/2', u'lime juice', 'oz'), (None, u'  7-Up\xae soda', None)]"
6.3,3,Kangaroo Kicker recipe,,"Shake ingredients in a cocktail shaker half-filled with ice cubes. Strain into a cocktail glass, garnish with a lemon twist, and serve.","[(u'2', u'vodka', 'oz'), (u'3/4', u'French vermouth', 'oz')]"
8.4,5,Kangaroo recipe,,Stir with ice and strain into a chillled cocktail glass. Garnish with a lemon zest.,"[(u'1 1/2', u'vodka', 'oz'), (u'1/2', u'vermouth', 'oz')]"
,,Kanawful's Serum recipe,,"Pour 1 part Kahlua, then pour 1 part Cream de Cacao (white), then pour 1 part Bailey's Irish Cream in a shot glass. Top it off with a puff of whipped cream. ","[(u'1/2', u""Bailey's\xae Irish cream"", 'oz'), (u'1/2', u'white creme de cacao', 'oz'), (u'1/2', u'Kahlua\xae coffee liqueur', 'oz'), (u'1/2', u'whipped cream', 'oz')]"
10.0,1,Kanapeas Kick recipe,,"Pour the Jack Daniel's Tennessee Whiskey into a collins glass 3/4 filled with ice cubes. Add the orange vodka and sweet and sour mix. Splash with Coca-cola, and serve.","[(u'4', u""Jack Daniel's\xae Tennessee whiskey"", 'oz'), (u'2', u'orange vodka', 'oz'), (u'5', u'sweet and sour mix', 'oz'), (u'1', u'Coca-Cola\xae', 'splash')]"
5.2,6,Kanaan recipe,,"Prepare in a blender with a little ice, pour into a highball glass, and serve.","[(None, u'15 cl milk', None), (None, u'1  egg', None), (u'2', u'honey', 'tsp')]"
,,Kamora Tootsie Roll recipe,,Add ingredients to a tumbler with ice. ,"[(u'1 1/2', u'Kamora\xae coffee liqueur', 'oz'), (u'4', u'orange juice', 'oz')]"
,,Kampai Cocktail recipe,,"Pour the rum, triple sec, pineapple juice and sour mix into a cocktail shaker half-filled with ice cubes. Shake well, and strain into a highball glass filled with ice cubes. Add bitters. Garnish with a maraschino cherry, and serve.","[(u'1', u'dark rum', 'oz'), (u'1/4', u'triple sec', 'oz'), (u'1', u'pineapple juice', 'oz'), (u'1', u'sweet and sour mix', 'oz'), (u'2', u'bitters', 'dashes')]"
,,Kamorita recipe,,Shake ingredients in a cocktail shaker with ice. Strain into a cocktail glass. ,"[(u'1 1/2', u'White Curacao liqueur', 'oz'), (u'1 1/2', u'Kahlua\xae coffee liqueur', 'oz'), (u'2', u'lime juice', 'tsp'), (u'1 1/2', u'pineapple juice', 'oz')]"
,,Kamora Sunrise Splash recipe,,Add ingredients to a tumbler with ice. Garnish with lime or grapefruit wedge if desired. ,"[(u'1 1/2', u'Kamora\xae coffee liqueur', 'oz'), (u'1', u'grapefruit juice', 'oz'), (u'4', u'orange juice', 'oz')]"
,,Kamora Vanilla Shake recipe,,Blend everything until smooth. Serve with vanilla wafer cookies. ,"[(u'1', u'white creme de cacao', 'tbsp'), (u'5', u'Kamora\xae coffee liqueur', 'tbsp'), (u'4', u'milk', 'oz'), (u'1/2', u'vanilla ice cream', 'cup')]"
2.0,1,Kamora Spanish Coffee recipe,,Add ingredients to mug of hot coffee; float puff of whipped cream on top. ,"[(u'3/4', u'brandy', 'oz'), (u'3/4', u'Kamora\xae coffee liqueur', 'oz'), (u'1', u'coffee', 'cup'), (u'1/2 - 1', u'whipped cream', 'oz')]"
,,Kamora Quencher recipe,,"Add Kamora to a highball glass with ice, fill with carbonated water and squeeze & drop in the lime wedge. ","[(u'1', u'Kamora\xae coffee liqueur', 'oz'), (u'5', u'club soda', 'oz'), (None, u'1  lime', None)]"
,,Kamora Satin Tango recipe,,Blend everything together with a few ice cubes. Garnish with a pineapple spear. ,"[(u'3', u'Kamora\xae coffee liqueur', 'oz'), (None, u'2 tspfresh lemon juice', None), (u'2', u'mango nectar', 'oz'), (u'2', u'pineapple juice', 'oz')]"
,,Kamora Mocha Mint recipe,,Shake everything with ice; strain into shot glasses. ,"[(u'1/2', u'white creme de cacao', 'oz'), (u'1/2', u'green creme de menthe', 'oz'), (u'1/2', u'Kamora\xae coffee liqueur', 'oz')]"
,,Kamora Rich Rewards recipe,,Blend ingredients together until smooth and serve with cookies. ,"[(u'1 1/2', u'Kamora\xae coffee liqueur', 'oz'), (u'5', u'chocolate milk', 'oz'), (u'2', u'chocolate', 'tsp'), (u'1/2', u'chocolate ice cream', 'cup')]"
,,Kamora Mexican Coffee recipe,,Add Kahlua and tequila to your hot cup of coffee. ,"[(u'1/2', u'white tequila', 'oz'), (u'1/2', u'Kahlua\xae coffee liqueur', 'oz'), (u'1', u'coffee', 'cup')]"
9.7,3,Kamora Hot Apple Cider recipe,,"Simmer cider, apple slices, Kahlua, cinnamon stick, and dried cherries in saucepan for 15 minutes. Stir in lemon juice, add butter if desired, and serve in mugs. ","[(u'1 1/2', u'Kamora\xae coffee liqueur', 'oz'), (u'16', u'apple cider', 'oz'), (u'1', u'lemon juice', 'tbsp'), (None, u'1/2 cupdried apple', None), (None, u'1  cinnamon', None), (u'1', u'butter', 'tsp')]"
,,Kamora Copper recipe,,Add everything ogether in a chilled champagne glass. ,"[(u'1', u'Kamora\xae coffee liqueur', 'oz'), (u'4', u'Champagne', 'oz'), (u'2', u'lemon juice', 'tsp')]"
,,Kamora Coffee Nut recipe,,"Add Kamora to your cup of hot coffee. Float a puff of whipped cream on top, sprinkle with chopped hazelnuts. ","[(u'1 1/2', u'Kamora\xae coffee liqueur', 'oz'), (u'1', u'coffee', 'cup'), (None, u'1 tspchopped hazelnuts', None), (u'1/2', u'whipped cream', 'oz')]"
,,Kamora Coffee Italiano recipe,,Add liqueurs to your hot cup of coffee. Float a puff of whipped cream on top. ,"[(u'3/4', u'Kamora\xae coffee liqueur', 'oz'), (u'3/4', u'sambuca', 'oz'), (u'1', u'coffee', 'cup'), (u'1/2 - 1', u'whipped cream', 'oz')]"
9.0,1,Kamora Cocoa Dream recipe,,Add Kahlua to a mug of hot chocolate. Float a puff of whipped cream on top. ,"[(u'1', u'Kamora\xae coffee liqueur', 'oz'), (u'8', u'hot chocolate', 'oz'), (u'1/2', u'whipped cream', 'oz')]"
9.0,1,Kamora and Cream recipe,,Add ice to a tumbler and pour the ingredients in. ,"[(u'1', u'Kamora\xae coffee liqueur', 'oz'), (u'4', u'cream', 'oz')]"
,,Kamikazeberry recipe,,"Mix all ingredients except raspberries in a shaker, pour into chilled martini glass with a sugared rim and garnish with raspberries. ","[(u'3', u'Smirnoff\xae Raspberry Twist vodka', 'oz'), (u'1', u'triple sec', 'oz'), (u'1', u'lime juice', 'splash'), (u'1', u'sweet and sour mix', 'splash'), (None, u'3  raspberries', None)]"
,,Kamora & Coffee recipe,,Mix Kamora into your hot cup of coffee. ,"[(u'1', u'Kamora\xae coffee liqueur', 'oz'), (u'8', u'coffee', 'oz')]"
7.8,4,Kamikazini recipe,,Add the vodka and the iced tea to a cocktail shaker. After shaking fill the drink in a cocktail glass. Serve with three green olives on a toothpick.,"[(u'1', u'Danzka\xae grapefruit vodka', 'oz'), (u'3', u'Nestea\xae diet iced tea', 'oz'), (None, u'3 green olives', None)]"
9.8,6,Kamikaze Wigglers recipe,,"Dissolve the jell-o with hot water. Add vodka and triple sec. Pour in plastic shot glasses. Chill until formed, and serve.","[(u'4', u'vodka', 'oz'), (u'4', u'triple sec', 'oz'), (None, u'8 ozhot water', None), (None, u'1 package lime jell-o', None)]"
9.4,14,Kamikaze Version recipe,,Add vodka and mixers to a cocktail glass with ice. Fill with sour mix and shake.,"[(u'3/4', u'vodka', 'oz'), (u'1/4', u'triple sec', 'oz'), (u'1/4', u'Blue Curacao liqueur', 'oz'), (None, u'  sweet and sour mix', None)]"
9.4,37,Kamikaze Shooter recipe,,"Pour ice cold vodka, triple sec, and sour mix into a chilled shot glass. Drop a pinch of sugar into the shooter and frost the glass with the remaining. ","[(u'3/4', u'vodka', 'oz'), (u'3/4', u'triple sec', 'oz'), (u'3/4', u'sweet and sour mix', 'oz'), (None, u'2 pinches sugar', None)]"
,,Kamikaze on the Rag recipe,,Fill a shaker with ice. Add ingredients and shake. Strain into a cocktail glass and garnish with a lime wedge. ,"[(u'3', u'cranberry vodka', 'oz'), (u'1/2', u'triple sec', 'oz'), (u'1/2', u'lime juice', 'oz')]"
8.8,19,Kamikaze Bomber recipe,,"Pour the Red Bull into an old fashioned glass, splash the grenadine to reddan the Bull. Pour a shot of Jagermeister and drop it into the glass. Consume that beverage kamikaze style.","[(u'1', u'Jagermeister\xae herbal liqueur', 'oz'), (u'3', u'Red Bull\xae energy drink', 'oz'), (u'1', u'grenadine syrup', 'splash')]"
8.2,6,Kamikaze Margarita recipe,,Blend everything until smooth. Pour into glasses and serve. ,"[(u'3', u'vodka', 'oz'), (u'3', u'triple sec', 'oz'), (u'3', u'lime juice', 'oz'), (u'3', u'margarita mix', 'oz'), (u'4', u'ice', 'cups')]"
9.3,3,Kamikaze Kool recipe,,Fill a cocktail glass with ice. Simultaneously pour in the vodka and grand marnier. Add lime juice. Stir with a straw and serve.,"[(u'1', u'vodka', 'oz'), (u'1', u'Grand Marnier\xae orange liqueur', 'oz'), (None, u""  Rose's\xae lime juice"", None)]"
9.1,47,Kamikaze #2 recipe,,Pour ingredients into a shot glass and serve.,"[(u'1', u'tequila', 'oz'), (u'1', u'triple sec', 'oz'), (u'1', u'lime juice', 'oz')]"
7.0,2,Maiden's Prayer #2 recipe,,Shake with crushed ice and strain into a chilled wine or cocktail glass. Serve with a lemon twist.,"[(u'3/4', u'gin', 'oz'), (u'3/4', u'light rum', 'oz'), (u'3/4', u'Cointreau\xae orange liqueur', 'oz'), (u'3/4', u'lemon juice', 'oz')]"
